title,summary,pub_date
"Stock market today: S&P 500, Nasdaq jump to fresh records, capping stunning second-quarter comeback","US stocks climbed to fresh records on Monday amid signs of progress in trade talks, ending one of the most volatile first halves of a year in recent memory.",2025-06-30T20:11:00Z
Apple stock surges despite analysts’ concerns over AI strategy shift,"Investing.com -- Apple (NASDAQ:AAPL) stock rose 2% Tuesday, extending Monday’s gains, following reports that the tech giant is considering using external AI technology to power its Siri voice assistant.",2025-07-01T14:50:27Z
Nvidia Slips As China AI Startups Race To Go Public – Is Nvidia A Buy Or Sell Now?,"Nvidia stock fell early Tuesday but remained near its all-time high as stock market trading began for the third quarter.  Likely pressuring the stock were moves by two Chinese artificial intelligence startups to go public.  One of them, Moore Threads, was founded by Zhang Jianzhong, a former Nvidia executive.",2025-07-01T14:30:22Z
Netflix’s Lofty Valuation Has Even Bullish Investors Nervous,"(Bloomberg) -- Netflix Inc. investors face a dilemma: Continue to bet on a stock that has delivered best-in-class returns over the past year or reconsider shares that increasingly look like they’re priced for perfection.Most Read from BloombergStruggling Downtowns Are Looking to Lure New CrowdsPhiladelphia Transit System Votes to Cut Service by 45%, Hike FaresSprawl Is Still Not the AnswerThe streaming giant’s stock price has nearly doubled over the last 12 months amid growth from advertising sa",2025-07-01T14:15:18Z
This Is The Only Stock Cathie Wood Bought on Monday,"Wood is partying like it's 2000, but only one stock was bought across the Ark Invest ETFs on the final trading day of June.",2025-07-01T14:15:00Z
Taiwan Semiconductor Seen Rising On AI Chip Growth,Taiwan Semiconductor Manufacturing is proving to be the engine of growth for the artificial intelligence megatrend.,2025-07-01T14:06:05Z
Broadcom Outpaced Major Indexes In 2025 - What Went Down,"In a period marked by investor caution in the U.S. tech sector, Broadcom Inc. (NASDAQ:AVGO) stands out with a 63% stock rally in just three months. Let’s unpack the compelling narrative behind Broadcom’s exceptional outperformance, delving into its strong second-quarter 2025 results, positive analyst sentiment, and future outlook. Broadcom, a dominant force in the Application-Specific Integrated Circuit (ASIC) market, focuses on high-performance computing, networking, and storage applications. T",2025-07-01T13:56:19Z
Is Alphabet's Stock Too Cheap to Ignore?,"Alphabet's stock looks undervalued when compared to other ""Magnificent Seven"" companies.  It's been an interesting year for the ""Magnificent Seven"" stocks, a name given to Alphabet (NASDAQ: GOOG) (NASDAQ: GOOGL), Apple, Microsoft, Nvidia, Amazon, Meta Platforms, and Tesla because of their size and influence on the market.  Although Alphabet hasn't experienced the worst drop this year (that honor goes to Tesla and Apple), it appears to be the most undervalued of the bunch after its recent declines.",2025-07-01T13:45:00Z
Is Apple Stock 'Dead Money' in July 2025? Watch This AAPL Options Indicator Now.,"AAPL is one of the worst-performing Magnificent 7 stocks of 2025. Is the stock dead money, or consolidating ahead of a breakout?",2025-07-01T13:04:29Z
AI momentum could drive more gains for tech in second half: Wall Street,"Investing.com -- Wall Street analysts are increasingly optimistic that artificial intelligence will continue to power technology stocks higher in the second half of 2025, with both Wolfe Research and Wedbush highlighting accelerating momentum in the space.",2025-07-01T12:59:52Z
